### ISSUE TITLE
opensmtpd: Cannot send mails from a musl system

### ISSUE THREAD

**Issue by QuadPiece** [void-linux/void-packages#5777]
### System

* xuname:  
  `Void 4.19.8_1 x86_64-musl GenuineIntel/KVM uptodate F`
* package:  
  `opensmtpd-6.4.0p2_1`

### Expected behavior
OpenSMTPD sends external mails as intended

### Actual behavior
Every time I send mail to an external address, OpenSMTPD fails with logs showing output similar to this:

```
2018-12-13T06:27:46.731661+00:00 hostname smtpd[1606]: smtp-out: Failed to resolve MX for [relay:gmail.com,smtp]: Temporary failure in MX lookup
2018-12-13T06:27:46.731697+00:00 hostname smtpd[1606]: 0000000000000000 mta delivery evpid=[redacted] from=<contact@quad.moe> to=<someone@gmail.com> rcpt=<-> source="-" relay="gmail.com" delay=0s result="TempFail" stat="Temporary failure in MX lookup"
```

It seems that OpenSMTPD cannot properly perform DNS lookups on a musl system, for whatever reason.

Found this OpenSMTPD issue, maybe it's relevant or helpful: https://github.com/OpenSMTPD/OpenSMTPD/issues/798

### Steps to reproduce the behavior

1. Set up opensmtpd-based mail server on a musl system
2. Try sending mail to any external SMTP server

Clearing `resolv.conf` and putting only `nameserver 8.8.8.8` and `nameserver 8.8.4.4` in the file does not help. 

Originally posted as a reply to https://github.com/voidlinux/void-packages/issues/6972, but I forgot the repos had moved

**Comment by chneukirchen** [comment]
Can you do a tcpdump of port 53 traffic during this failure?

**Comment by QuadPiece** [comment]
I get the following output when I try sending to a Gmail address:

```
06:52:06.344705 IP 192.168.50.51.52317 > kate.208.67.222.222.53: 17670+ PTR? 138.132.230.46.in-addr.arpa. (45)
06:52:06.345662 IP 192.168.50.51.56542 > kate.208.67.222.222.53: 11828+ PTR? 20.50.168.192.in-addr.arpa. (44)
06:52:06.346626 IP kate.208.67.222.222.53 > 192.168.50.51.56542: 11828* 1/0/0 PTR kate.208.67.222.222. (77)
06:52:06.346670 IP 192.168.50.51.58393 > kate.208.67.222.222.53: 41273+ PTR? 51.50.168.192.in-addr.arpa. (44)
06:52:06.347430 IP kate.208.67.222.222.53 > 192.168.50.51.58393: 41273 NXDomain* 0/0/0 (44)
06:52:06.843019 IP kate.208.67.222.222.53 > 192.168.50.51.52317: 17670 ServFail 0/0/0 (45)
06:52:07.695850 IP 192.168.50.51.59919 > kate.208.67.222.222.53: 17670+ MX? gmail.com. (27)
06:52:07.741970 IP kate.208.67.222.222.53 > 192.168.50.51.59919: 17670 5/0/0 MX gmail-smtp-in.l.google.com. 5, MX alt1.gmail-smtp-in.l.google.com. 10, MX alt4.gmail-smtp-in.l.google.com. 40, MX alt3.gmail-smtp-in.l.google.com. 30, MX alt2.gmail-smtp-in.l.google.com. 20 (150)
```

Like always, a `Temporary failure in MX lookup` in the mail logs.  
Also tried with `8.8.8.8` in `resolv.conf` instead. Gives me the same dump as far as I could see.

**Comment by chneukirchen** [comment]
I have it fixed, and it's really silly. Will push after tree is clean again.

**Comment by chneukirchen** [comment]
Please update libasr (55b8e0a8fc).

**Comment by QuadPiece** [comment]
Thank you very much for the aforementioned hour of your life. After updating libasr I can now send outgoing mails without issue.
